{
  "schema_version": "1.0.0",
  "robot_id": "P2-02",
  "robot_type": "P2_TRANSPORT",
  "batch_seq": 189,
  "sample_rate_hz": 1.0,
  "start_t_s": 11340,
  "end_t_s": 11399,
  "channels": [
    "wheel_fl_current_a",
    "wheel_fl_speed_rads",
    "wheel_fl_temp_c",
    "wheel_fr_current_a",
    "wheel_fr_speed_rads",
    "wheel_fr_temp_c",
    "wheel_rl_current_a",
    "wheel_rl_speed_rads",
    "wheel_rl_temp_c",
    "wheel_rr_current_a",
    "wheel_rr_speed_rads",
    "wheel_rr_temp_c",
    "battery_voltage_v",
    "battery_current_a",
    "battery_soc_pct",
    "lift_joint_current_a",
    "lift_joint_pos_err_deg"
  ],
  "samples": [
    {
      "t_s": 11340,
      "timestamp": "2027-03-01T03:09:00Z",
      "op_mode": "TRAVERSE_EMPTY",
      "wheel_fl_current_a": 4.108,
      "wheel_fl_speed_rads": 2.198,
      "wheel_fl_temp_c": 52.61,
      "wheel_fr_current_a": 3.277,
      "wheel_fr_speed_rads": 2.24,
      "wheel_fr_temp_c": 34.03,
      "wheel_rl_current_a": 3.381,
      "wheel_rl_speed_rads": 2.256,
      "wheel_rl_temp_c": 33.92,
      "wheel_rr_current_a": 3.261,
      "wheel_rr_speed_rads": 2.26,
      "wheel_rr_temp_c": 33.53,
      "battery_voltage_v": 49.813,
      "battery_current_a": 2.869,
      "battery_soc_pct": 73.6,
      "lift_joint_current_a": 0.066,
      "lift_joint_pos_err_deg": 0.028
    },
    {
      "t_s": 11341,
      "timestamp": "2027-03-01T03:09:01Z",
      "op_mode": "TRAVERSE_EMPTY",
      "wheel_fl_current_a": 4.019,
      "wheel_fl_speed_rads": 2.184,
      "wheel_fl_temp_c": 52.56,
      "wheel_fr_current_a": 3.314,
      "wheel_fr_speed_rads": 2.249,
      "wheel_fr_temp_c": 34.17,
      "wheel_rl_current_a": 3.275,
      "wheel_rl_speed_rads": 2.255,
      "wheel_rl_temp_c": 33.79,
      "wheel_rr_current_a": 3.207,
      "wheel_rr_speed_rads": 2.273,
      "wheel_rr_temp_c": 33.61,
      "battery_voltage_v": 49.899,
      "battery_current_a": 2.78,
      "battery_soc_pct": 73.6,
      "lift_joint_current_a": 0.016,
      "lift_joint_pos_err_deg": 0.059
    },
    {
      "t_s": 11342,
      "timestamp": "2027-03-01T03:09:02Z",
      "op_mode": "TRAVERSE_EMPTY",
      "wheel_fl_current_a": 4.162,
      "wheel_fl_speed_rads": 2.196,
      "wheel_fl_temp_c": 52.56,
      "wheel_fr_current_a": 3.238,
      "wheel_fr_speed_rads": 2.244,
      "wheel_fr_temp_c": 34.31,
      "wheel_rl_current_a": 3.265,
      "wheel_rl_speed_rads": 2.254,
      "wheel_rl_temp_c": 33.8,
      "wheel_rr_current_a": 3.157,
      "wheel_rr_speed_rads": 2.257,
      "wheel_rr_temp_c": 33.76,
      "battery_voltage_v": 49.803,
      "battery_current_a": 2.798,
      "battery_soc_pct": 73.6,
      "lift_joint_current_a": -0.013,
      "lift_joint_pos_err_deg": 0.071
    },
    {
      "t_s": 11343,
      "timestamp": "2027-03-01T03:09:03Z",
      "op_mode": "TRAVERSE_EMPTY",
      "wheel_fl_current_a": 4.12,
      "wheel_fl_speed_rads": 2.178,
      "wheel_fl_temp_c": 52.82,
      "wheel_fr_current_a": 3.336,
      "wheel_fr_speed_rads": 2.259,
      "wheel_fr_temp_c": 34.36,
      "wheel_rl_current_a": 3.336,
      "wheel_rl_speed_rads": 2.253,
      "wheel_rl_temp_c": 33.45,
      "wheel_rr_current_a": 3.283,
      "wheel_rr_speed_rads": 2.25,
      "wheel_rr_temp_c": 33.4,
      "battery_voltage_v": 49.825,
      "battery_current_a": 2.759,
      "battery_soc_pct": 73.6,
      "lift_joint_current_a": 0.114,
      "lift_joint_pos_err_deg": 0.021
    },
    {
      "t_s": 11344,
      "timestamp": "2027-03-01T03:09:04Z",
      "op_mode": "TRAVERSE_EMPTY",
      "wheel_fl_current_a": 4.036,
      "wheel_fl_speed_rads": 2.195,
      "wheel_fl_temp_c": 52.94,
      "wheel_fr_current_a": 3.33,
      "wheel_fr_speed_rads": 2.23,
      "wheel_fr_temp_c": 33.56,
      "wheel_rl_current_a": 3.335,
      "wheel_rl_speed_rads": 2.244,
      "wheel_rl_temp_c": 33.49,
      "wheel_rr_current_a": 3.305,
      "wheel_rr_speed_rads": 2.267,
      "wheel_rr_temp_c": 33.53,
      "battery_voltage_v": 49.871,
      "battery_current_a": 2.844,
      "battery_soc_pct": 73.6,
      "lift_joint_current_a": 0.074,
      "lift_joint_pos_err_deg": 0.072
    },
    {
      "t_s": 11345,
      "timestamp": "2027-03-01T03:09:05Z",
      "op_mode": "TRAVERSE_EMPTY",
      "wheel_fl_current_a": 4.157,
      "wheel_fl_speed_rads": 2.177,
      "wheel_fl_temp_c": 52.91,
      "wheel_fr_current_a": 3.353,
      "wheel_fr_speed_rads": 2.255,
      "wheel_fr_temp_c": 33.67,
      "wheel_rl_current_a": 3.276,
      "wheel_rl_speed_rads": 2.26,
      "wheel_rl_temp_c": 33.35,
      "wheel_rr_current_a": 3.235,
      "wheel_rr_speed_rads": 2.266,
      "wheel_rr_temp_c": 33.23,
      "battery_voltage_v": 49.912,
      "battery_current_a": 2.851,
      "battery_soc_pct": 73.6,
      "lift_joint_current_a": 0.056,
      "lift_joint_pos_err_deg": 0.074
    },
    {
      "t_s": 11346,
      "timestamp": "2027-03-01T03:09:06Z",
      "op_mode": "TRAVERSE_EMPTY",
      "wheel_fl_current_a": 4.131,
      "wheel_fl_speed_rads": 2.204,
      "wheel_fl_temp_c": 52.52,
      "wheel_fr_current_a": 3.271,
      "wheel_fr_speed_rads": 2.26,
      "wheel_fr_temp_c": 34.07,
      "wheel_rl_current_a": 3.261,
      "wheel_rl_speed_rads": 2.261,
      "wheel_rl_temp_c": 34.01,
      "wheel_rr_current_a": 3.219,
      "wheel_rr_speed_rads": 2.242,
      "wheel_rr_temp_c": 33.47,
      "battery_voltage_v": 49.859,
      "battery_current_a": 2.8,
      "battery_soc_pct": 73.6,
      "lift_joint_current_a": -0.025,
      "lift_joint_pos_err_deg": 0.087
    },
    {
      "t_s": 11347,
      "timestamp": "2027-03-01T03:09:07Z",
      "op_mode": "TRAVERSE_EMPTY",
      "wheel_fl_current_a": 4.048,
      "wheel_fl_speed_rads": 2.185,
      "wheel_fl_temp_c": 52.78,
      "wheel_fr_current_a": 3.363,
      "wheel_fr_speed_rads": 2.258,
      "wheel_fr_temp_c": 34.14,
      "wheel_rl_current_a": 3.322,
      "wheel_rl_speed_rads": 2.253,
      "wheel_rl_temp_c": 33.83,
      "wheel_rr_current_a": 3.236,
      "wheel_rr_speed_rads": 2.259,
      "wheel_rr_temp_c": 33.61,
      "battery_voltage_v": 49.863,
      "battery_current_a": 2.863,
      "battery_soc_pct": 73.6,
      "lift_joint_current_a": 0.157,
      "lift_joint_pos_err_deg": 0.068
    },
    {
      "t_s": 11348,
      "timestamp": "2027-03-01T03:09:08Z",
      "op_mode": "TRAVERSE_EMPTY",
      "wheel_fl_current_a": 4.098,
      "wheel_fl_speed_rads": 2.189,
      "wheel_fl_temp_c": 52.65,
      "wheel_fr_current_a": 3.351,
      "wheel_fr_speed_rads": 2.246,
      "wheel_fr_temp_c": 34.14,
      "wheel_rl_current_a": 3.424,
      "wheel_rl_speed_rads": 2.226,
      "wheel_rl_temp_c": 33.49,
      "wheel_rr_current_a": 3.261,
      "wheel_rr_speed_rads": 2.26,
      "wheel_rr_temp_c": 33.54,
      "battery_voltage_v": 49.85,
      "battery_current_a": 2.857,
      "battery_soc_pct": 73.6,
      "lift_joint_current_a": 0.005,
      "lift_joint_pos_err_deg": 0.11
    },
    {
      "t_s": 11349,
      "timestamp": "2027-03-01T03:09:09Z",
      "op_mode": "TRAVERSE_EMPTY",
      "wheel_fl_current_a": 4.145,
      "wheel_fl_speed_rads": 2.187,
      "wheel_fl_temp_c": 52.63,
      "wheel_fr_current_a": 3.282,
      "wheel_fr_speed_rads": 2.249,
      "wheel_fr_temp_c": 33.52,
      "wheel_rl_current_a": 3.285,
      "wheel_rl_speed_rads": 2.262,
      "wheel_rl_temp_c": 33.48,
      "wheel_rr_current_a": 3.242,
      "wheel_rr_speed_rads": 2.266,
      "wheel_rr_temp_c": 33.67,
      "battery_voltage_v": 49.908,
      "battery_current_a": 2.715,
      "battery_soc_pct": 73.6,
      "lift_joint_current_a": 0.016,
      "lift_joint_pos_err_deg": 0.074
    },
    {
      "t_s": 11350,
      "timestamp": "2027-03-01T03:09:10Z",
      "op_mode": "TRAVERSE_EMPTY",
      "wheel_fl_current_a": 4.189,
      "wheel_fl_speed_rads": 2.166,
      "wheel_fl_temp_c": 52.87,
      "wheel_fr_current_a": 3.209,
      "wheel_fr_speed_rads": 2.256,
      "wheel_fr_temp_c": 33.77,
      "wheel_rl_current_a": 3.324,
      "wheel_rl_speed_rads": 2.264,
      "wheel_rl_temp_c": 33.68,
      "wheel_rr_current_a": 3.258,
      "wheel_rr_speed_rads": 2.264,
      "wheel_rr_temp_c": 33.52,
      "battery_voltage_v": 49.861,
      "battery_current_a": 2.909,
      "battery_soc_pct": 73.6,
      "lift_joint_current_a": 0.019,
      "lift_joint_pos_err_deg": 0.116
    },
    {
      "t_s": 11351,
      "timestamp": "2027-03-01T03:09:11Z",
      "op_mode": "TRAVERSE_EMPTY",
      "wheel_fl_current_a": 4.055,
      "wheel_fl_speed_rads": 2.202,
      "wheel_fl_temp_c": 52.6,
      "wheel_fr_current_a": 3.304,
      "wheel_fr_speed_rads": 2.256,
      "wheel_fr_temp_c": 34.11,
      "wheel_rl_current_a": 3.352,
      "wheel_rl_speed_rads": 2.236,
      "wheel_rl_temp_c": 33.41,
      "wheel_rr_current_a": 3.283,
      "wheel_rr_speed_rads": 2.247,
      "wheel_rr_temp_c": 33.29,
      "battery_voltage_v": 49.819,
      "battery_current_a": 2.893,
      "battery_soc_pct": 73.6,
      "lift_joint_current_a": 0.125,
      "lift_joint_pos_err_deg": 0.043
    },
    {
      "t_s": 11352,
      "timestamp": "2027-03-01T03:09:12Z",
      "op_mode": "TRAVERSE_EMPTY",
      "wheel_fl_current_a": 4.124,
      "wheel_fl_speed_rads": 2.182,
      "wheel_fl_temp_c": 52.81,
      "wheel_fr_current_a": 3.391,
      "wheel_fr_speed_rads": 2.24,
      "wheel_fr_temp_c": 34.38,
      "wheel_rl_current_a": 3.373,
      "wheel_rl_speed_rads": 2.25,
      "wheel_rl_temp_c": 33.32,
      "wheel_rr_current_a": 3.331,
      "wheel_rr_speed_rads": 2.255,
      "wheel_rr_temp_c": 33.37,
      "battery_voltage_v": 49.875,
      "battery_current_a": 2.842,
      "battery_soc_pct": 73.6,
      "lift_joint_current_a": -0.025,
      "lift_joint_pos_err_deg": 0.084
    },
    {
      "t_s": 11353,
      "timestamp": "2027-03-01T03:09:13Z",
      "op_mode": "TRAVERSE_EMPTY",
      "wheel_fl_current_a": 4.213,
      "wheel_fl_speed_rads": 2.208,
      "wheel_fl_temp_c": 52.62,
      "wheel_fr_current_a": 3.251,
      "wheel_fr_speed_rads": 2.26,